{
  "episode_id": "classification_mmlu_subset_v1__difficulty_routing__000",
  "task_family": "classification",
  "task_id": "classification_mmlu_subset_v1_task_000",
  "policy_id": "difficulty_routing",
  "policy_class": "full_automation",
  "model_id": "cheap_model",
  "prompt_version": "v1",
  "started_at": "2026-03-08T12:00:00+00:00",
  "ended_at": "2026-03-08T12:00:02.750000+00:00",
  "duration_seconds": 2.75,
  "final_status": "success",
  "failure_category": null,
  "quality_score": 0.88,
  "quality_metrics": {
    "accuracy": 0.88,
    "pass_rate": null,
    "f1": 0.87,
    "precision": null,
    "recall": null
  },
  "quality_threshold_met": true,
  "attempts": [
    {
      "attempt_index": 0,
      "attempt_model_id": "cheap_model",
      "input_tokens": 500,
      "output_tokens": 80,
      "attempt_latency_seconds": 2.75,
      "attempt_cost_usd": 0.001848,
      "verification_count": 0,
      "tool_call_count": 0,
      "tool_cost_usd": 0.0,
      "attempt_outcome": "accepted"
    }
  ],
  "indirect_cost": {
    "retry_count": 0,
    "human_review_count": 0,
    "human_review_minutes": 0.0,
    "human_intervention_count": 0,
    "escalation_trigger": null,
    "recovery_step_count": 0,
    "routing_decision_count": 1,
    "fallback_path_used": false
  },
  "derived_metrics": {
    "total_direct_cost_usd": 0.001848,
    "total_tool_cost_usd": 0.0,
    "total_token_count": 580,
    "total_latency_seconds": 2.75,
    "total_human_minutes": 0.0,
    "total_retry_count": 0,
    "total_verification_count": 0,
    "total_recovery_steps": 0
  },
  "notes": "Deterministic stub episode generated from benchmark and policy config."
}
