{
  "episode_id": "classification_mmlu_subset_v1__cheap_model_single_pass__classification_002",
  "task_family": "classification",
  "task_id": "classification_002",
  "policy_id": "cheap_model_single_pass",
  "policy_class": "full_automation",
  "model_id": "cheap_model",
  "prompt_version": "real_v1",
  "started_at": "2026-03-08T13:01:00+00:00",
  "ended_at": "2026-03-08T13:01:00.900000+00:00",
  "duration_seconds": 0.9,
  "final_status": "failure",
  "failure_category": "quality_below_threshold",
  "quality_score": 0.0,
  "quality_metrics": {
    "accuracy": 0.0,
    "pass_rate": null,
    "f1": null,
    "precision": null,
    "recall": null
  },
  "quality_threshold_met": false,
  "attempts": [
    {
      "attempt_index": 0,
      "attempt_model_id": "cheap_model",
      "input_tokens": 27,
      "output_tokens": 1,
      "attempt_latency_seconds": 0.9,
      "attempt_cost_usd": 0.0,
      "verification_count": 0,
      "tool_call_count": 0,
      "tool_cost_usd": 0.0,
      "attempt_outcome": "failed"
    }
  ],
  "indirect_cost": {
    "retry_count": 0,
    "human_review_count": 0,
    "human_review_minutes": 0.0,
    "human_intervention_count": 0,
    "escalation_trigger": null,
    "recovery_step_count": 0,
    "routing_decision_count": 0,
    "fallback_path_used": false
  },
  "derived_metrics": {
    "total_direct_cost_usd": 0.0,
    "total_tool_cost_usd": 0.0,
    "total_token_count": 28,
    "total_latency_seconds": 0.9,
    "total_human_minutes": 0.0,
    "total_retry_count": 0,
    "total_verification_count": 0,
    "total_recovery_steps": 0
  },
  "notes": "Real execution layer episode using provider adapter."
}
