{
  "episode_id": "coding_humaneval_v1__cheap_model_verifier_hitl__002",
  "task_family": "coding",
  "task_id": "coding_humaneval_v1_task_002",
  "policy_id": "cheap_model_verifier_hitl",
  "policy_class": "selective_hitl",
  "model_id": "cheap_model",
  "prompt_version": "v1",
  "started_at": "2026-03-08T12:02:00+00:00",
  "ended_at": "2026-03-08T12:02:14.040000+00:00",
  "duration_seconds": 14.04,
  "final_status": "human_escalation",
  "failure_category": "human_escalation",
  "quality_score": 0.96,
  "quality_metrics": {
    "accuracy": null,
    "pass_rate": 0.96,
    "f1": null,
    "precision": null,
    "recall": null
  },
  "quality_threshold_met": false,
  "attempts": [
    {
      "attempt_index": 0,
      "attempt_model_id": "cheap_model",
      "input_tokens": 700,
      "output_tokens": 320,
      "attempt_latency_seconds": 7.8,
      "attempt_cost_usd": 0.003082,
      "verification_count": 1,
      "tool_call_count": 0,
      "tool_cost_usd": 0.0,
      "attempt_outcome": "accepted"
    },
    {
      "attempt_index": 1,
      "attempt_model_id": "strong_model",
      "input_tokens": 350,
      "output_tokens": 160,
      "attempt_latency_seconds": 6.24,
      "attempt_cost_usd": 0.001541,
      "verification_count": 1,
      "tool_call_count": 0,
      "tool_cost_usd": 0.0,
      "attempt_outcome": "accepted"
    }
  ],
  "indirect_cost": {
    "retry_count": 1,
    "human_review_count": 1,
    "human_review_minutes": 1.0,
    "human_intervention_count": 1,
    "escalation_trigger": "verifier_failure_or_retry_exhaustion",
    "recovery_step_count": 1,
    "routing_decision_count": 0,
    "fallback_path_used": false
  },
  "derived_metrics": {
    "total_direct_cost_usd": 0.004623,
    "total_tool_cost_usd": 0.0,
    "total_token_count": 1530,
    "total_latency_seconds": 14.04,
    "total_human_minutes": 1.0,
    "total_retry_count": 1,
    "total_verification_count": 2,
    "total_recovery_steps": 1
  },
  "notes": "Deterministic stub episode generated from benchmark and policy config."
}
