{
  "episode_id": "classification_mmlu_subset_v1__confidence_gated_hitl__002",
  "task_family": "classification",
  "task_id": "classification_mmlu_subset_v1_task_002",
  "policy_id": "confidence_gated_hitl",
  "policy_class": "selective_hitl",
  "model_id": "cheap_model",
  "prompt_version": "v1",
  "started_at": "2026-03-08T12:02:00+00:00",
  "ended_at": "2026-03-08T12:02:05.400000+00:00",
  "duration_seconds": 5.4,
  "final_status": "success",
  "failure_category": null,
  "quality_score": 0.86,
  "quality_threshold_met": true,
  "attempts": [
    {
      "attempt_index": 0,
      "attempt_model_id": "cheap_model",
      "input_tokens": 500,
      "output_tokens": 80,
      "attempt_latency_seconds": 3.0,
      "attempt_cost_usd": 0.00132,
      "verification_count": 0,
      "tool_call_count": 0,
      "tool_cost_usd": 0.0,
      "attempt_outcome": "accepted"
    },
    {
      "attempt_index": 1,
      "attempt_model_id": "cheap_model",
      "input_tokens": 250,
      "output_tokens": 40,
      "attempt_latency_seconds": 2.4,
      "attempt_cost_usd": 0.00066,
      "verification_count": 0,
      "tool_call_count": 0,
      "tool_cost_usd": 0.0,
      "attempt_outcome": "accepted"
    }
  ],
  "indirect_cost": {
    "retry_count": 1,
    "human_review_count": 1,
    "human_review_minutes": 2.0,
    "human_intervention_count": 1,
    "escalation_trigger": "confidence_below_threshold",
    "recovery_step_count": 0,
    "routing_decision_count": 0,
    "fallback_path_used": false
  },
  "derived_metrics": {
    "total_direct_cost_usd": 0.00198,
    "total_tool_cost_usd": 0.0,
    "total_token_count": 870,
    "total_latency_seconds": 5.4,
    "total_human_minutes": 2.0,
    "total_retry_count": 1,
    "total_verification_count": 0,
    "total_recovery_steps": 0
  },
  "notes": "Deterministic stub episode generated from benchmark and policy config."
}
