{
  "episode_id": "extraction_structured_fields_v1__human_first__extraction_001",
  "task_family": "extraction",
  "task_id": "extraction_001",
  "policy_id": "human_first",
  "policy_class": "human_first",
  "model_id": "strong_model",
  "prompt_version": "real_v1",
  "started_at": "2026-03-08T13:00:00+00:00",
  "ended_at": "2026-03-08T13:00:01.800000+00:00",
  "duration_seconds": 1.8,
  "final_status": "success",
  "failure_category": null,
  "quality_score": 1.0,
  "quality_metrics": {
    "accuracy": null,
    "pass_rate": null,
    "f1": 1.0,
    "precision": 1.0,
    "recall": 1.0
  },
  "quality_threshold_met": true,
  "attempts": [
    {
      "attempt_index": 0,
      "attempt_model_id": "strong_model",
      "input_tokens": 27,
      "output_tokens": 17,
      "attempt_latency_seconds": 1.8,
      "attempt_cost_usd": 0.0,
      "verification_count": 1,
      "tool_call_count": 0,
      "tool_cost_usd": 0.0,
      "attempt_outcome": "accepted"
    }
  ],
  "indirect_cost": {
    "retry_count": 0,
    "human_review_count": 0,
    "human_review_minutes": 5.0,
    "human_intervention_count": 0,
    "escalation_trigger": null,
    "recovery_step_count": 0,
    "routing_decision_count": 0,
    "fallback_path_used": false
  },
  "derived_metrics": {
    "total_direct_cost_usd": 0.0,
    "total_tool_cost_usd": 0.0,
    "total_token_count": 44,
    "total_latency_seconds": 1.8,
    "total_human_minutes": 5.0,
    "total_retry_count": 0,
    "total_verification_count": 1,
    "total_recovery_steps": 0
  },
  "notes": "Real execution layer episode using provider adapter."
}
